{
  "type": "object",
  "additionalProperties": false,
  "properties": {
    "schemaVersion": {
      "const": 1
    },
    "modelId": {
      "type": "string",
      "minLength": 1
    },
    "name": {
      "type": "string",
      "minLength": 1,
      "maxLength": 120
    },
    "parts": {
      "type": "object",
      "additionalProperties": {
        "type": "object",
        "additionalProperties": false,
        "properties": {
          "color": {
            "type": "string",
            "pattern": "^#[0-9A-Fa-f]{6}$"
          },
          "material": {
            "enum": [
              "pla",
              "matte-pla",
              "silk-pla",
              "pla-cf",
              "petg",
              "matte-petg",
              "metallic-petg",
              "petg-cf",
              "abs",
              "asa",
              "pc",
              "pa",
              "pa-cf",
              "tpu"
            ]
          },
          "stockId": {
            "type": "string",
            "pattern": "^[A-Za-z0-9_-]{1,80}$",
            "description": "ID of an item in the local filament inventory. While set, the part follows that spool's color and material."
          },
          "coating": {
            "type": "object",
            "required": [
              "kind",
              "color"
            ],
            "additionalProperties": false,
            "properties": {
              "kind": {
                "const": "acrylic"
              },
              "color": {
                "type": "string",
                "pattern": "^#[0-9A-Fa-f]{6}$"
              }
            }
          }
        },
        "required": [
          "color",
          "material"
        ]
      }
    },
    "lighting": {
      "type": "object",
      "additionalProperties": false,
      "properties": {
        "preset": {
          "enum": [
            "studio",
            "daylight",
            "warm",
            "cinema"
          ]
        },
        "intensity": {
          "type": "number",
          "minimum": 0.3,
          "maximum": 1.8
        },
        "azimuth": {
          "type": "number",
          "minimum": -180,
          "maximum": 180
        },
        "pattern": {
          "enum": [
            "butterfly",
            "rembrandt",
            "split",
            "rim"
          ],
          "description": "Lamp setup for the cinema stage. Omit for the preset's own placement."
        }
      },
      "required": [
        "preset",
        "intensity",
        "azimuth"
      ]
    },
    "surface": {
      "type": "object",
      "additionalProperties": false,
      "properties": {
        "layers": {
          "type": "boolean"
        }
      },
      "required": [
        "layers"
      ]
    }
  },
  "required": [
    "schemaVersion",
    "modelId",
    "name",
    "parts",
    "lighting",
    "surface"
  ],
  "$schema": "https://json-schema.org/draft/2020-12/schema",
  "title": "Color Studio Palette v1"
}
